{
  "assembly_metadata": {
    "assembled_at": "2026-07-28T10:00:00+00:00",
    "assembler_id": "terminology-contracts-migration",
    "assembler_version": "1.1.0",
    "source_package_hashes": {
      "attestation_evidence_sha256": "98413e7291143a381b59009d68399eb909105026cd32b3711bbb19f5d12c8d45",
      "context_evidence_sha256": "9eeb88d113f70a4247ff1e380b59545f4620d803e3d9dacdc6bab7f9adfbd0e8"
    }
  },
  "attestation_evidence": {
    "accepted_evidence_refs": [
      {
        "evidence_id": "att-1",
        "evidence_type": "ATTESTATION_SOURCE",
        "sha256": "bbbbbbbbbbbbbbbbbbbbbbbbbbbbbbbbbbbbbbbbbbbbbbbbbbbbbbbbbbbbbbbb",
        "uri": "artifact://attestation/att-1"
      }
    ],
    "candidate_key": {
      "candidate_id": "cand-inference-vi-01",
      "candidate_version": "1",
      "candidate_vi": "suy luận",
      "dataset_manifest_sha256": "1111111111111111111111111111111111111111111111111111111111111111",
      "effective_sense_contract_sha256": "82eedc4661ad441fd7e1925b61738b3ad97af9c2eacb9ce99f2209b45fe1dd0b",
      "scope_id": "machine_learning",
      "sense_id": "model_execution",
      "sense_inventory_version": "sense-v1",
      "source_term": "inference"
    },
    "diagnostics": null,
    "features": {
      "E_authority": 0.75,
      "E_concept": 0.83,
      "E_conventionality": 0.6,
      "E_coverage": 0.8,
      "E_domain": 1.0,
      "E_independence": 0.67
    },
    "final_glossary_decision": null,
    "flags": [],
    "input_contract_sha256": "ad9888fdb98fba49d6a7b50f30d8749694e28c89a5dd3f7fdea0ae490ccdf704",
    "integrity": {
      "self_sha256": "98413e7291143a381b59009d68399eb909105026cd32b3711bbb19f5d12c8d45"
    },
    "local_status": "ATTESTED",
    "observed_variants": [
      {
        "evidence_refs": [
          {
            "evidence_id": "att-2",
            "evidence_type": "ATTESTATION_SOURCE",
            "sha256": "bbbbbbbbbbbbbbbbbbbbbbbbbbbbbbbbbbbbbbbbbbbbbbbbbbbbbbbbbbbbbbbb",
            "uri": "artifact://attestation/att-2"
          }
        ],
        "status": "PROPOSE_FOR_CST_VARIANT_CHECK",
        "surface_vi": "bước suy luận"
      }
    ],
    "provenance": {
      "completed_at": "2026-07-28T10:01:00+00:00",
      "component_id": "vietnamese-attestation",
      "component_version": "1.0.0",
      "execution_config_sha256": "70455fb6b79d4b1d6630f91653ad91fa8c4d7d71e8c45a9a07976b2872fe346c",
      "model_routes": [
        {
          "independence_group": "group-demo",
          "model_family": "family-demo",
          "model_id": "model-demo",
          "provider_id": "provider-demo"
        }
      ],
      "notes": null,
      "policy_version": "demo-policy-v1",
      "prompt_hashes": {
        "main": "9999999999999999999999999999999999999999999999999999999999999999"
      },
      "raw_ledger_ref": {
        "evidence_id": "ledger-001",
        "evidence_type": "OTHER",
        "sha256": "aaaaaaaaaaaaaaaaaaaaaaaaaaaaaaaaaaaaaaaaaaaaaaaaaaaaaaaaaaaaaaaa",
        "uri": "artifact://runs/run-demo-001"
      },
      "run_id": "run-demo-001",
      "run_spec_id": "run-demo-001-spec-migrated-v1-1",
      "source_artifact_hashes": {
        "dataset": "1111111111111111111111111111111111111111111111111111111111111111"
      },
      "started_at": "2026-07-28T10:00:00+00:00"
    },
    "rejected_evidence_refs": [],
    "schema_id": "AttestationEvidencePackageV1",
    "schema_version": "1.1.0",
    "stage_metrics": {
      "duplicate_cluster_count": 1,
      "extraction_coverage": 0.9,
      "fetch_coverage": 0.9,
      "independent_organization_count": 3,
      "judge_coverage": 0.9,
      "language_coverage": 1.0,
      "search_coverage": 1.0,
      "span_yield": 0.5,
      "unique_document_count": 6
    }
  },
  "candidate_key": {
    "candidate_id": "cand-inference-vi-01",
    "candidate_version": "1",
    "candidate_vi": "suy luận",
    "dataset_manifest_sha256": "1111111111111111111111111111111111111111111111111111111111111111",
    "effective_sense_contract_sha256": "82eedc4661ad441fd7e1925b61738b3ad97af9c2eacb9ce99f2209b45fe1dd0b",
    "scope_id": "machine_learning",
    "sense_id": "model_execution",
    "sense_inventory_version": "sense-v1",
    "source_term": "inference"
  },
  "context_evidence": {
    "candidate_key": {
      "candidate_id": "cand-inference-vi-01",
      "candidate_version": "1",
      "candidate_vi": "suy luận",
      "dataset_manifest_sha256": "1111111111111111111111111111111111111111111111111111111111111111",
      "effective_sense_contract_sha256": "82eedc4661ad441fd7e1925b61738b3ad97af9c2eacb9ce99f2209b45fe1dd0b",
      "scope_id": "machine_learning",
      "sense_id": "model_execution",
      "sense_inventory_version": "sense-v1",
      "source_term": "inference"
    },
    "contrastive_status": "AVAILABLE",
    "diagnostics": null,
    "features": {
      "C_max": 0.96,
      "C_mean": 0.88,
      "C_min": 0.7,
      "C_range": 0.26,
      "evidence_coverage": 1.0,
      "fail_count": 0,
      "judge_agreement": 0.9,
      "minor_count": 1,
      "pass_count": 4,
      "required_context_type_coverage": 1.0,
      "valid_context_count": 5
    },
    "final_glossary_decision": null,
    "flags": [],
    "input_contract_sha256": "ad9888fdb98fba49d6a7b50f30d8749694e28c89a5dd3f7fdea0ae490ccdf704",
    "integrity": {
      "self_sha256": "9eeb88d113f70a4247ff1e380b59545f4620d803e3d9dacdc6bab7f9adfbd0e8"
    },
    "local_status": "CONTEXT_SUPPORTED",
    "provenance": {
      "completed_at": "2026-07-28T10:01:00+00:00",
      "component_id": "context-substitution",
      "component_version": "1.0.0",
      "execution_config_sha256": "56dd8aa5074dc152745759923794e447d85150d6b2bc1d0314edef2382928105",
      "model_routes": [
        {
          "independence_group": "group-demo",
          "model_family": "family-demo",
          "model_id": "model-demo",
          "provider_id": "provider-demo"
        }
      ],
      "notes": null,
      "policy_version": "demo-policy-v1",
      "prompt_hashes": {
        "main": "9999999999999999999999999999999999999999999999999999999999999999"
      },
      "raw_ledger_ref": {
        "evidence_id": "ledger-001",
        "evidence_type": "OTHER",
        "sha256": "aaaaaaaaaaaaaaaaaaaaaaaaaaaaaaaaaaaaaaaaaaaaaaaaaaaaaaaaaaaaaaaa",
        "uri": "artifact://runs/run-demo-001"
      },
      "run_id": "run-demo-001",
      "run_spec_id": "run-demo-001-spec-migrated-v1-1",
      "source_artifact_hashes": {
        "dataset": "1111111111111111111111111111111111111111111111111111111111111111"
      },
      "started_at": "2026-07-28T10:00:00+00:00"
    },
    "review_artifact_sha256": "2222222222222222222222222222222222222222222222222222222222222222",
    "schema_id": "ContextEvidencePackageV1",
    "schema_version": "1.1.0",
    "selector_mode": "FROZEN_HUMAN_REVIEWED_SELECTION",
    "support_set": {
      "contrastive_refs": [
        {
          "evidence_id": "ctx-x1",
          "evidence_type": "CONTRASTIVE_CONTEXT",
          "sha256": "bbbbbbbbbbbbbbbbbbbbbbbbbbbbbbbbbbbbbbbbbbbbbbbbbbbbbbbbbbbbbbbb",
          "uri": "artifact://context/ctx-x1"
        }
      ],
      "negative_or_boundary_refs": [],
      "positive_support_refs": [
        {
          "evidence_id": "ctx-1",
          "evidence_type": "CONTEXT",
          "sha256": "bbbbbbbbbbbbbbbbbbbbbbbbbbbbbbbbbbbbbbbbbbbbbbbbbbbbbbbbbbbbbbbb",
          "uri": "artifact://context/ctx-1"
        }
      ]
    }
  },
  "input_contract_sha256": "ad9888fdb98fba49d6a7b50f30d8749694e28c89a5dd3f7fdea0ae490ccdf704",
  "integrity": {
    "self_sha256": "17082bce9ee2f306f5280c1bdb3a5c5ad8c8f60d015203eadc09f39930331b6d"
  },
  "optional_probes": [],
  "schema_id": "GlobalValidatorInputV1",
  "schema_version": "1.1.0"
}
